{
  "kind": "workflow-instance",
  "schemaVersion": "1.0.0",
  "id": "build-product-2026-03-14T10-13-41-335Z",
  "workflowId": "build-product",
  "workflowName": "Build Product",
  "goal": {
    "summary": "AI 私域自动化系统",
    "companyId": "ai-startup-company",
    "companyName": "AI Startup Company",
    "ruleIds": [
      "company-must-own-agents",
      "agent-must-have-skill",
      "workflow-step-agent-must-be-company-agent",
      "workflow-step-skill-must-be-allowed",
      "architecture-step-requires-approval",
      "release-step-requires-approval",
      "development-step-retries-on-failure",
      "testing-step-handoff-to-release-manager"
    ]
  },
  "status": "completed",
  "createdAt": "2026-03-14T10:13:41.335Z",
  "updatedAt": "2026-03-14T10:13:41.407Z",
  "startedAt": "2026-03-14T10:13:41.335Z",
  "completedAt": "2026-03-14T10:13:41.406Z",
  "currentStepId": null,
  "taskIds": [
    "build-product-task-1",
    "build-product-task-2",
    "build-product-task-3",
    "build-product-task-4",
    "build-product-task-5"
  ],
  "runIds": [
    "build-product-task-1-run-1",
    "build-product-task-2-run-1",
    "build-product-task-3-run-1",
    "build-product-task-4-run-1",
    "build-product-task-5-run-1"
  ],
  "storage": {
    "resultDir": "tasks/results/build-product-2026-03-14T10-13-41-335Z",
    "logFile": "tasks/logs/build-product-2026-03-14T10-13-41-335Z.log",
    "queueFile": "tasks/queue/build-product-2026-03-14T10-13-41-335Z.json",
    "aggregateMemoryFile": "memory/projects/build-product-2026-03-14T10-13-41-335Z.json",
    "taskStateDir": "state/tasks/build-product-2026-03-14T10-13-41-335Z",
    "runStateDir": "state/runs/build-product-2026-03-14T10-13-41-335Z",
    "memoryRecordDir": "state/memory-records/build-product-2026-03-14T10-13-41-335Z",
    "decisionGateDir": "state/decision-gates/build-product-2026-03-14T10-13-41-335Z",
    "eventsFile": "state/events/build-product-2026-03-14T10-13-41-335Z.jsonl"
  },
  "stats": {
    "totalTasks": 5,
    "pendingTasks": 0,
    "readyTasks": 0,
    "inProgressTasks": 0,
    "doneTasks": 5,
    "blockedTasks": 0,
    "totalRuns": 5,
    "queuedRuns": 0,
    "runningRuns": 0,
    "succeededRuns": 5,
    "failedRuns": 0
  },
  "error": null
}